question,optionA,optionB,optionC,optionD,answer,,,,,,,,,,,,,topic_chapter,topic_confidence,all_topics,matched_keywords,topic_section_id,topic_section_title,topic_section_confidence,all_sections,matched_section_keywords
Pure water contains small but equal amounts of hydronium (H 3O+) ions and hydroxide (OH−) ions. This means that water is:,acidic,basic,acidic and basic,neither acidic nor basic,D,,,,,,,,,,,,,Chapter 1 - Chemicals,0.992,Chapter 1 - Chemicals,"and, contain, h, ion, ion and, is, of, water",chapter_1::1_7_carbohydrates_heads_up,1.7 Carbohydrates (Heads-up),0.981,chapter_1::1_7_carbohydrates_heads_up; chapter_1::1_6_organic_and_inorganic_compounds_heads_up,"and, contain, h, water"
The tricuspid valve separates which two structures?,right ventricle and pulmonary trunk,right ventricle and right atrium,left ventricle and aorta,left ventricle and left atrium,B,,,,,,,,,,,,,Chapter 1 - Chemicals,0.908,Chapter 1 - Chemicals,"separate, structure, the, two",chapter_1::1_7_carbohydrates_heads_up,1.7 Carbohydrates (Heads-up),0.811,chapter_1::1_7_carbohydrates_heads_up; chapter_16::16_4_pituitary_gland_hypothalamus_heads_up; chapter_2::2_5_the_animal_kingdom_heads_up; chapter_2::2_6_the_classification_of_vertebrates_heads_up,"structure, two"
Which digestive enzyme in saliva breaks down starch?,trypsin,lipase,pepsin,amylase,D,,,,,,,,,,,,,Chapter 1 - Chemicals,0.803,Chapter 1 - Chemicals,"enzyme, in, starch",chapter_1::1_7_carbohydrates_heads_up,1.7 Carbohydrates (Heads-up),0.803,chapter_1::1_7_carbohydrates_heads_up; chapter_9::9_3_diffusion_transport_of_oxygen_heads_up,"in, starch"
What do “sympathetic” and “parasympathetic” divisions refer to?,the central nervous system,the efferent neurons of the peripheral nervous system,the autonomic nervous system,"the somatic nervous system 14.3 Autonomic System, Neurotransmitters, Reﬂ exes 380",C,,,,,,,,,,,,,Chapter 1 - Chemicals,0.642,Chapter 1 - Chemicals; Chapter 2 - Classification; Chapter 16 - Endocrine System; Chapter 10 - Lymphatic System; Chapter 9 - Respiratory System,"and, to",chapter_1::1_7_carbohydrates_heads_up,1.7 Carbohydrates (Heads-up),0.803,chapter_1::1_7_carbohydrates_heads_up; chapter_1::1_9_proteins_heads_up; chapter_2::2_5_the_animal_kingdom_heads_up; chapter_1::1_2_elements_and_atoms_heads_up; chapter_1::1_6_organic_and_inorganic_compounds_heads_up; chapter_9::9_x_x_mechanics_of_inspiration,"and, to"
To what energy can an x-ray tube that is operated at 110 kV accelerate electrons?,110 eV,110 keV 17 Ionising Radiation 443,110 joules,"110,000 keV",B,,,,,,,,,,,,,Chapter 1 - Chemicals,0.871,Chapter 1 - Chemicals,"at, energi, is, to",chapter_1::1_7_carbohydrates_heads_up,1.7 Carbohydrates (Heads-up),0.759,chapter_1::1_7_carbohydrates_heads_up; chapter_1::1_8_fats_heads_up; chapter_10::10_2_1_lymphatic_vessels_heads_up,"energi, to"
