question,optionA,optionB,optionC,optionD,answer
When performing cardio-pulmonary resuscitation (CPR) why do you use the “heel” of the hand rather than the whole palm and fingers?,A greater force can be exerted by the “heel” of the hand which results in a greater pressure being exerted.,"Using the “heel” places a smaller area of the hand in contact with the ster - num, hence allows a greater force to be exerted.",The same force can be applied to a smaller area of the sternum which is less able to resist the greater downward pressure.,The resuscitator’s wrist is less likely to be damaged by applying CPR in this way.,C
Which of these statements about pressure in static liquids is NOT true? Pressure at a point in a liquid,depends on the height of liquid above it.,acts equally in all directions.,depends on the depth it is below the surface.,depends on the volume of liquid above it.,D
Which of the following statements about stationary liquids is FALSE?,"At the liquid surface, pressure equals atmospheric pressure.",The volume of liquid in an enclosed space can be compressed.,Pressure increases with depth.,Pressure due to weight of liquid is called ‘head of pressure’.,B
Which of the following statements about pressure is true?,"As boxes are stacked on top of each other, the pressure that they exert on the floor decreases.",Very small forces will exert small pressures.,"By standing on wide flat boards, the pressure exerted on the floor by your body is decreased.12.4 Pressure: The Physics of Pressure 282",Objects of large mass will produce large pressures.,C
"When an 80 kg person is seated on a stool so that the area of contact is 400 cm2, the pressure on the stool due to the person’s weight is very nearly",2 kPa,20 kPa,200 kPa,2000 kPa,B
"Given that pressure is force divided by area, and that the acceleration due to gravity is 10 m/s2, what is the pressure (in kPa) that would be experienced by the bony prominences?",1 kPa,10 kPa,100 kPa,60 kPa,B
A patient lying on a mattress of enclosed air is less likely to develop decubitis ulcers because the:,mass of the patient is decreased.,force exerted by the patient is decreased. 12 Cardiovascular System 283,patient’s surface area in contact with the mattress is increased.,pressure exerted by the patient on the mattress is increased.,C
A bedridden patient is less likely to develop bed sores while lying on a water bed. This is because:,the force applied to their bony projections is acting over a tiny area.,the flexibility of the bed assists the blood circulation.,the weight of the patient is being supported by parts of the body that are adapted for weight-bearing.,the patient experiences a uniform pressure over most of the lower surface of their body.,D
The consideration of pressure in gases differs from pressure in liquids because,pressure at any point in a gas acts differently in different directions.,"in a gas mixture, the pressure exerted by each different gas must be considered.12.4 Pressure: The Physics of Pressure 284",the pressure in a liquid increases with depth but does not for a gas.,liquids are virtually incompressible whereas gases are compressible.,D
Which of the following sentences best represents a statement of the Bernoulli effect? Pressure in a…,flowing fluid is greatest where its speed is greatest.,fluid acts equally in all directions.,flowing fluid is lowest where its speed is lowest.,flowing fluid is lowest where its speed is greatest.,D
A statement of Boyle’s law could be:,"as pressure of a gas increases, its solubility increases","as volume of a gas increases, its pressure decreases.","as volume of a gas decreases, its pressure decreases.","as pressure of a gas increases, its solubility decreases.",B
What effect will increasing the concentration of red cells in blood have? It will:,decrease blood viscosity and increase aortic pressure,increase blood viscosity and decrease aortic pressure,increase blood viscosity and increase aortic pressure,decrease blood viscosity and decrease aortic pressure,C
The intravenous cannula that will give the largest flow rate is:,0.7 mm diameter 32 mm length,0.7 mm diameter 19 mm length,1.8 mm diameter 32 mm length,1.8 mm diameter 19 mm length,D
"If a stenosis reduces the size of a blood vessel to half of the original diameter, the volume flow rate through the vessel will be reduced. Which relationship below determines the extent of the decrease in flow?",Poiseuille’s law.,Bernoulli’s theorem.12.5 Pressure Applied to the Cardiovascular System 296,Dalton’s law.,Pascal’s principle.,A
Blood flow is largely regulated at a tissue level. Which of the following could be said regarding this process?,A rise in the blood level of O 2 will result in vasodilation,A raised CO 2 level results in vasodilation,Acidaemia directly increases vasopressin (ADH) release,A raised CO 2 blood level will result in an increased serum alkalinity,B
Which of the following is most unlikely to increase blood viscosity?,leucocytosis,dehydration,hypothermia,an infusion of packed red blood cells,A
"If dietary salt intake is excessive, which of the following will NOT occur?",Less ADH will be secreted,The osmolarity of extracellular fluids will increase,The thirst centre will be stimulated,The extracellular fluid volume increases,A
Which of the following is NOT true about turbulent blood flow?,turbulent flows exists when blood is flowing in smooth streamlines.,it may occur when blood passes through a constriction or stenosis.,it occurs if blood speed is high.,turbulent flow is noisy.,A
What is “autoregulation”? It is the adjustment of blood flow to each tissue due to:,hormonal control,neural control,systemic factors,local factors,D
What function is served by the goblet/mucus cells of the bronchial “tree”?,they trap small inhaled particles.,they secrete mucus onto the surface of the airways,they increase the surface area available for gas exchange.,they move mucus up the bronchial tree.,B
A bronchiole differs from a bronchus in that it is:,unable to change its diameter (& a bronchus can),able to change its diameter (& a bronchus cannot),a smaller diameter tube than is a bronchus,a larger diameter tube than is a bronchus,B
What are the cells that produce surfactant called?,mucus cells,ciliated cells,alveolar macrophages,type II pneumocytes,D
What are the main muscles involved in normal inspiration?,muscles of the neck,abdominal muscles,intercostal muscles,intercostals and the diaphragm,D
When the diaphragm contracts which of the following will happen in the lungs?,"air pressure will increase, volume will decrease and exhalation will occur.","air pressure will decrease, volume will increase and exhalation will occur.","air pressure will decrease, volume will increase and inhalation will occur.","air pressure will increase, volume will increase and inhalation will occur.",C
A pump used to clear an airway of obstructing liquid expands the volume in its chamber to produce a:,negative pressure and liquid is pushed by atmospheric pressure into the chamber.,positive pressure and liquid is pushed by atmospheric pressure into the chamber.,negative pressure and liquid is sucked up into the chamber.,positive pressure and liquid is sucked by atmospheric pressure into the chamber.,A
"Boyle’s law may be stated as: “when the volume of an enclosed gas expands, its pressure decreases”. Thus the pressure in our lungs will:",increase as our diaphragm contracts.,be negative as we breathe out.,be negative as our rib cage moves up and out.,be positive as our rib cage moves up and out,C
Boyle’s law states that pressure multiplied by volume is a constant value. Hence which of the following statements is correct?,The amount of air in the lungs will increase when the pressure inside them increases.,A positive pressure is produced in the lungs when the chest expands,A negative pressure is produced in the lungs when the chest expands.,The amount of air in the lungs will decrease when the pressure in them decreases.,C
Recall Boyle’s law applied to the lungs. Which of the following would occur as air pressure in the lungs increases?,volume increases,volume decreases,the lungs expand,the diaphragm contracts,B
Which word correctly completes the statement: “All motor neurons are…”,interneurons,multipolar,bipolar,unipolar,B
What type of neurones are motor neurones?,Anaxonic,Multipolar,Bipolar,Unipolar,B
What is true about the spino-thalamic tract?,it is a descending pathway that carries sensory information,it is a descending pathway that carries motor instructions,it is an ascending pathway that carries sensory information,it is an ascending pathway that carries motor instructions,C
What and where is the pre-central gyrus?,It is the site of sensory function and is in the frontal lobe.,It is the site of sensory function and is in the parietal lobe.,It is the site of motor function and is in the frontal lobe.,It is the site of motor function and is in the parietal lobe.,C
One of the following is not a meninge. Which one?,Pia mater,Alma mater,Arachnoid mater,Dura mater,B
Which of the following is NOT a meninge?,cerebra mater,pia mater,dura mater,arachnoid mater,A
One of the functions of the prefrontal cortex is:,making conscious decisions,controlling motor functions,detecting and integrating sensory information,enabling word recognition,A
The central sulcus separates gyri involved with which two major functions?,vision and taste,vision and hearing,motor and sensory,emotion and memory,C
If a person had a pre-frontal lobotomy what would be the physiological consequences?,Movement would be impaired,Sensory function would be impaired,The ability to assess the consequence of actions would be impaired,Speech would be impaired,C
What is the purpose of inserting a needle into the epidural space? It:,Allows access to the cerebro-spinal ﬂ uid,Enables the cerebro-spinal ﬂ uid pressure to be measured,Enables permanent drainage of cerebro-spinal ﬂ uid to treat hydrocephalus,Allows access to administer analgesia and anaesthesia,D
Which of the following neural pathways or tracts carry sensory information?,cortico-bulbar tracts,spino-thalamic tracts,cortico-spinal tracts,reticulo-spinal tracts,B
To what part of the nervous system does the somatic nervous system belong?,"efferent, central nervous system","efferent, peripheral nervous system","afferent, peripheral nervous system","afferent, central nervous system",B
Sensory receptors convert stimuli that are above threshold into what?,graded potentials,neurotransmitters,action potentials,motor activity in muscles,C
The deterioration of sight with age is known by which term?,protanopia,presbyopia,hyperopia,scotopia,B
The change in vision that occurs with ageing is called,protanopia.,hyperopia.,deuteranopia.,presbyopia.,D
One of the following is NOT a secondary sex characteristic. Which one?,the adult male body shape,the thicker vocal cords of a male,pubic hair,the penis,D
Which of the following is/are NOT associated with the male reproductive system?,estrogens,androgens,FSH and LH,the tunica vaginalis,A
Which cells develop into the corpus luteum?,granulosa cells,interstitial cells,cells of the antrum,thecal cells,A
What is a fertilised egg known as?,ovum,zygote,embryo,blastocyst,B
Which statement about the “granulosa cells” is NOT correct?,they produce estrogens and inhibin,they form a single layer around the primary follicle,they form the corpus luteum,one of them will develop into the ovum,D
The advantage of Computed Tomography (CT) over conventional radiography is:,CT delivers lower doses than conventional radiography.,CT images are faster to acquire than conventional radiographs.,CT produces a cross-sectional image that is not obscured by overlying ana- tomical structures.,CT projects a 3D structure onto a 2D image.,C
The contrast of a CT image displayed on a monitor may be increased by,increasing the window width,increasing the window level,decreasing the window width,decreasing the window level,C
Which of the following pairs of nuclides are isotopes?,2760Co and 2860Ni,4399Tc and 4298Mo,1940K and 4019K,1940K and 1939K,D
Which nuclide does the symbol X in the nuclear reaction 4399 00 mTc→+Xγ refer to?,4399mTc,4399Tc,4499Ru,4299Mo,B
"In the nuclear reaction: 2760 00Co→+γX, what does the symbol ‘X’ represent?",2860Co,2759Co,2760Co,2660Co,C
Choose the alternative which correctly completes the following sentence: ‘There are two types of electric charge called…,protons and electrons and they attract each other.’,positive and negative and they attract each other.’,anions and cations and they repel each other.’,electrons and ions and they repel each other.’,B
"In order for the ‘on-off’ switch and the fuse to operate as intended in AC cir- cuits, which wires must they be placed on?","switch on active wire, fuse on earth wire.","switch on earth wire, fuse on neutral wire.",both switch and fuse on active wire.,both switch and fuse on earth wire.,C
"Suppose that while crawling around inside the roof space of your house, you touch a bare wire with your bare hand while touching the brick wall with the other bare hand. Which of the following wires would be most likely to deliver a fatal shock?",The neutral wire.,The active wire.,The telephone wire.,The earth wire.,B
"In the ﬂ uids of the human body, what are the carriers of charge that move through ﬂ uids called?",cations,ions,anions,electrons,B
Which of the following is correct?,Fixed traction employs a moveable pulley to provide mechanical advantage.,In suspended traction the traction force is equal to the tension in the cord.,"In suspended traction, counter-traction is provided by the friction between the patient and the bed.",The traction force must be equal in magnitude to but opposite in direction to the counter-traction force.,D
"If a traction hanging mass is 3 kg, use Newton’s second law (or otherwise) to determine the gravitational force acting on the mass.",0.3 newtons,3 newtons,30 newtons,3 kilograms,C
A person whose mass is 65 kg would have a weight closest to:,65 kg because mass and weight are directly proportional to each other (on Earth).,650 kg because weight mass=´ 10 (approximately) 19 Biomechanics 477,65 N because FF12=- (Newton’s 3rd law),650 N because Fm a=´ (Newton’s 2nd law),D
In straight leg traction (Buck’s extension) the force of counter traction is sup- plied by friction (between the patient and the bed) and also by:,the component of the patient’s weight that is perpendicular to the bed.,the component of the patient’s weight that is parallel to the bed. 19 Biomechanics 478,gravity acting on the hanging mass.,using cords to attach the patient to the head of the bed.,B
A person whose mass is 50 kg would have a weight closest to:,50 kg because mass and weight are directly proportional to each other (on Earth).,50 N because FF12=- (Newton’s 3rd law),500 kg because weight mass=´ 10 (approximately),500 N because Fm a=´ (Newton’s 2nd law),D
In which of the following situations is an unbalanced force acting on a patient’s body? When the patient is:,lying stationary and supine on the bed.,lying stationary and supine on the bed while the bed is being pushed a con- stant speed along a straight corridor.,being assisted to sit still and upright on the edge of the bed.,lying stationary and supine on the bed while the bed is being pushed around a corner in a corridor.,D
What is a nurse attempting to minimise by getting close to a patient during a manual handling procedure?,the load arm,the size of the fulcrum,the effort arm,the patient’s weight,A
Good manual handling technique on an unconscious patient involves which of the following?,using the muscles of the arms,instructing the patient on how to shift themself.,using the muscles of the legs,using the muscles of the back,C
Good manual handling technique generally requires extensive use of which muscles?,biceps brachii and triceps brachii,erector spinae and abdominal muscles,gluteus maximus and rectus abdominus,quadriceps and hamstrings,D
What is the weight of a nurse if her mass is 65 kg? (use acceleration due to gravity of 10 m.s −2 ),65 kg,650 kg,65 N,650 N,D
Which of the following is not an example of a force?,Tension.,Friction.,Inertia.,Weight.,C
Which one of the following describes what could happen to an object when a balanced force is acting on it? The object,starts to move.,changes its direction but not its speed.,object changes its shape.,nothing happens.,D
"In cars, the aim of safety features such as seatbelts, padding on the dashboard, collapsible steering columns, airbags and body panels that crumple progressively, is to minimise the unbalanced force on occupants during a crash. Bearing Newton’s second law in mind. How do such features achieve? They",minimise the occupant’s deceleration.,maximise the occupant’s deceleration.,prevent whiplash injuries.,convert an unbalanced force into a net force.,A
What is the best deﬁ nition of the WEIGHT of an object? Weight is the:,force of attraction between the Earth and the object.,tendency of a body to maintain its state of motion.,amount of matter contained in the body.,mass of the object multiplied by its acceleration.,A
Which of the following is NOT considered part of good lifting technique?,Keeping the feet close together.,Keeping the back virtually straight. 19 Biomechanics 488,Standing close to the object to be lifted.,Bending the knees.,A
"Fixed traction may be applied by a device such as a ‘Thomas splint’. In this case, the counter-traction force is supplied by",the push of the appliance on a ﬁ xed point on the body (such as the ischial tuberosity).,an adhesive bandage wrapped around the lower leg.,the pull of a wire that is made taut by turning a wingnut attached to the patient’s foot.,the weight of the patient’s leg and the friction between the patient and the bed.,A
The counter-traction force on a patient’s leg is often increased by tilting the bed so that the patient’s head is lower than their feet. Why is this done? Because tilting the bed increases the,component of the patient’s weight that is parallel to the bed.,traction force that is exerted by the hanging masses.,force of gravity that is acting on the patient’s body.,component of the patient’s weight that is perpendicular to the bed.,A
What are the two purposes served by pulleys used in traction systems? These are to:,reduce friction and provide support for the limbs in traction.,supply a mechanical advantage and attachment points to the bed frame.,"allow the hanging masses to exert a traction force greater than their weight, and redirect the direction of the effort force.",change the direction of the cords and suspend the limb from the bed.,C
