question,optionA,optionB,optionC,optionD,answer
Which of the following is the best deﬁ nition of physiology?,The microscopic study of tissues and cells,The study of how the body works.,All the chemical processes that take place in the organelles of the body’s cells.,The body’s automatic tendency to maintain a relatively constant internal environment.,B
"If the DNA strand sequence of bases is CTT AGA CTA ATA, what would the tRNA read?",GAA TCT GAT TAT,CUU AGA CUA AUA,GAA UCU GAU UAU,GUU ACA GUA AUA,C
Which of the following metric preﬁ xes is used to denote one thousandth of a gram?,micro,milli,centi,kilo,B
Which of the following g does NOT describe a milligram?,1 × 10 3 gram,1 × 10 −3 gram,one thousandth of a gram,0.001 gram,A
How many micrograms are there in 5 milligram?,0.005,0.5,500,5000,D
"Given that a milligram 1 × 10 −3 gram, what is a microgram?",1 × 10 3 gram,One thousand milligram,1 × 10 −6 gram,0.001 gram,C
How many micrograms are there in one milligram?,0.001,0.1,100,1000,D
How many milligrams are there in one microgram?,0.001,1000,0.1,1000000,A
What is meant when a person’s mass is stated as 73.6 kg? That,the mass is closer to 73.6 than it is to 73.7 or 73.5,the mass is closer to 73.6 than to any other value,the mass is between 73.5 and 73.7,the mass is 73.6 ± 0.1 kg,A
What is 3400 square centimetres converted to square metres?,0.0034 m 2,0.34 m 2,3.4 m 2,34 m 2,B
What is the number 0.028 when correctly expressed in scientiﬁ c notation?,28 × 10 2,2.8 × 10 2,2.8 × 10 −2,28 × 10 −2,C
Which of the following numbers has four signiﬁ cant ﬁ gures?,3300,37.6,0.008,0.054,B
The chemical name for sodium is which of the following?,Na,So,K,Si,A
One of the following is INCORRECT. Which one?,metal atoms will form compounds with non-metal atoms.,metal atoms will form compounds with metal atoms.,non-metal atoms will form compounds with non-metal atoms.,metal atoms will not form compounds with metal atoms.,B
Most non-molecular compounds form by the chemical combination of:,molecules with molecules,non-metals with non-metals,metals with metals,metals with non-metals,D
Which of the following is true of metal elements?,"The four most common metal elements in the body have the symbols: C, H, O and N.",They form compounds with non-metals.4.1 Atoms and Molecules 48,"When they form compounds, they gain electrons.","In the body, ions of metal atoms have a negative charge.",B
The symbol for potassium is which of the following?,PO 4,Po,P,K,B
"Which of the following atoms normally forms ions having a single, positive charge?",Mg,S,Cl,K,D
Which of the following statements concerning isotopes is FALSE?,They contain the same number of protons in their atoms.,They contain the same number of electrons in their atoms.,They contain the same number of neutrons in their atoms.,They have very similar chemical properties.,C
How many grams of sodium chloride are there in (0.9 %) normal saline?,0.09 g per 100 ml,0.09 g per litre,9 g per 100 ml,9 g per litre,D
How many grams of sodium chloride are there in a one litre bag of 0.9 % saline?,0.09 g,0.9 g,9 g,90 g,C
What is the condition known as hyperkalemia characterised by? A,higher than normal concentration of potassium in the blood.,lower than normal concentration of potassium in the blood.,serum sodium concentration greater than 150 mmol/l.,serum sodium concentration greater than 5 mmol/l.,A
Which of the body’s fluid compartments does the vascular compartment form part of?,interstitial fluid,extracellular fluid,intracellular fluid,transcellular fluid,B
To what condition does the term “hypokalemia” refer?,too little phosphorus in the blood,too much sodium in the blood,too little potassium in the blood,too little sodium in the blood,C
Which of the following is correct for intra-cellular fluid (ICF) and extra-cellular fluid (ECF)?,the ECF is part of the ICF,the majority of the body’s water is in the ECF,the ICF contains more sodium than the ECF,the ICF contains more potassium than the ECF,D
"In the context of fluid (water) balance, the body is said to have “two compart- ments”. What are they?",the vascular and the interstitial compartments,the intracellular and the interstitial compartments,the lymph and the vascular compartments,the extracellular and the intracellular compartments,D
What is an insufficient concentration of potassium in the blood known as?,hypokalemia,hyponatremia,hypopotassemia,hypocalcemia,A
What may hyponatremia be described as?,insufficient potassium in the blood,insufficient iron in the blood,insufficient sodium in the blood,excess sodium in the blood,C
An intravenous fluid that is hypertonic to blood would have what effect on the red blood cells?,it would have no effect.,the number of red blood cells would increase,red blood cells would lyse.,it would cause red blood cells to crenate.,D
An intravenous fluid that is isotonic to blood would have what effect on the red blood cells?,it would have no effect.,it would cause red blood cells to crenate.,red blood cells would lyse.,the blood volume would increase.,A
"The isotonic concentration for sodium chloride is 0.9 %, and for glucose is 5 %. Which of the following solutions is isotonic with the above solutions? A solu-tion containing:",5 % glucose and 0.25 % sodium chloride,0.9 % sodium chloride and 0.5 % glucose,2.5 % sodium chloride and 2.5 % glucose,4 % glucose and 0.18 % sodium chloride,D
Which of the four IV solutions below is hypotonic?,0.18 % sodium chloride and 4 % glucose,0.3 % sodium chloride and 3.3 % glucose,0.45 % sodium chloride,0.9 % sodium chloride,C
Which of the following solutions is the most hypertonic?,0.3 % sodium chloride and 3.3 % glucose,0.45 % sodium chloride and 2.5 % glucose,0.45 % sodium chloride,10 % glucose,D
Which of the following statements best describes what all isotonic solutions have in common? They:,contain the same concentration of glucose molecules,contain the same total concentration of particles,contain the same concentration of sodium chloride,have the same specific gravity,B
"If the pH of a patient’s blood is 7.4, then it can be said that the patient has:",acidic blood,alkaline blood 4 Chemistry for Physiology 85,neutral blood,alkalosis,B
"If a sample of blood has a pH of 7.25, which of the following is true?",it is in the healthy range,it is neutral 4 Chemistry for Physiology 87,it is acidic,it is basic,D
"If the pH of a sample of blood was 7.4, which term below would be applied to it?",acidotic,"acidic4.5 Acids, Bases and Buffers 88",alkalotic,alkaline,D
"In the condition known as acidosis, the blood pH would be",greater than 7.45.,less than 7.45.,less than 7.35.,less than 7.00.,C
One of the following is NOT a function of lipids in the body. Which one?,function as co-enzymes.,used in phospholipids.,used to make prostaglandins.,steroids are produced from them.,A
To which of the following class of biological compounds do all enzymes belong?,Hormones,Proteins,Carbohydrates,Lipids,B
The twisting of a polypeptide chain into a characteristic shape such as a helix is an example of which of the following?,Primary structure,Secondary structure,Tertiary structure,Quaternary structure,C
What are the structural components of proteins?,Amino acids,Fatty acids,Peptides,Monosaccharides,A
What are the four most common elements found in proteins?4.6 Organic Chemistry and Macromolecules 98,"C, H, N, Ca","C, O, N, Fe","C, H, N, O","N, C, H, Na",C
Which of the following is a typical formula for a polypeptide?,C57H110O6,C18H29O2,C21H41O5N8,C6H12O6,C
The one medicine may have many names. What is the “generic name” of a medicine?,the name that describes the effect of the drug on the body.,the systematic name of the chemical involved.,the name given to the product by a manufacturer of the drug.,the name proposed by the inventor and approved by a government agency.,D
Which of the following structures represents molecules belonging to the amide family?,CH 3 – SH,CH 3 – NH 2,CH 3 – CO – NH 2,CH 3 – OH,C
Only one of the following patterns of bond is ever displayed by carbon atoms in organic compounds. (each line represents a bond) Which is it?,| ─ C ≡,ǁ ─ C ─ |,| ─ C ═,─ C ≡ |,C
Certain components of food are often referred to as being saturated. This term refers to the bonding of carbon atoms present in molecules of the food. Which of the following bonding arrangements is a saturated environment?,─ C ≡ C ─,| ═ C ═ C ─,| | ─ C ─ C ─ | |,─ C ═ C ─ | |,C
What purpose is vitamin D (calcitriol) used for?,required for several stages of haemostasis,required for uptake of calcium from the gut,required for erythropoiesis,required for uptake of intrinsic factor,B
One of the functions of bones is to make red blood cells. What is this process known as?,Haemolysis,Haemopoiesis 7 Skeleton and Joints 127,Haematuria,Haemostasis,B
What are the bones of the ﬁ ngers known as?,short bones,metacarpals,carpals,phalanges,D
Which of the following comprise seven bones?,Cervical vertebrae,Carpals,Cranial bones,Lumbar vertebrae,A
What body part is able to perform pronation and supination?,the forearm,the foot 7 Skeleton and Joints 129,the thigh,the wrist,A
Which of the following bones is part of the cranium?,occipital,mandible,hyoid,carpal,A
The appendicular skeleton includes all of the following EXCEPT one. Which one?,the pectoral girdle,the thoracic cage,the phalanges,the lower limbs,B
Which list contains the bones of the pelvic and pectoral girdles?,"coxal, scapulae, manubrium, ilium","clavicles, cervical, coccyx, innominate","clavicles, scapulae, coxal","clavicles, scapulae, sacrum, coxal",C
Articulating bones are joined by,aponeuroses,tendons,fasciculi,ligaments,D
The axial skeleton groups together which sets of bones?,"the arms and hands, the legs and feet, shoulder girdle and pelvic girdle.","the head, shoulder girdle, arms and hands.","the thoracic cage, vertebral column, shoulder girdle, the pelvic girdle, the skull and facial bones.","bones of the skull and face, thoracic cage and vertebral column.",D
The appendicular skeleton groups together which sets of bones?,"the arms and hands, the legs and feet, shoulder girdle and pelvic girdle.","the head, shoulder girdle, arms and hands.","the thoracic cage, vertebral column, shoulder girdle, the pelvic girdle, the skull and facial bones.","bones of the skull and face, thoracic cage and vertebral column.",A
The human skeleton consists of which of the following?,"pectoral girdle, the hip girdle and the bones of the limbs.",axial skeleton and the appendicular skeleton.,"cranial bones, the thoracic cage, the two girdles and the limb bones.","appendicular skeleton, skull bones and the vertebral skeleton.",B
Which of the muscles listed below is named according to its action?,adductor longus,temporalis,sternocleidomastoid,peroneus longus,A
Which of the following muscles is a common intra-muscular injection site?,deltoid,gluteus maximus,vastus medialis,latissimus dorsi,A
Which of the following muscles is NOT named after its location in the body?,deltoid,extensor carpi ulnaris,rectus abdominus,biceps femoris,A
Which of the following muscles is NOT named after its location in the body?,latissimus dorsi,adductor longus,rectus femoris,biceps brachii,B
Which muscles extend the leg?,quadriceps,hamstrings,gluteus muscles,"soleus, gastrocnemius & tibialis anterior",A
Which of the following muscles IS named after its location in the body?,sartorius,triceps brachii,soleus,trapezius,B
The muscles involved in mastication include which of the following?,"sternocleidomastoid, scalene","sartorius, gracilis, soleus","temporalis, masseter, buccinator","orbicularis oculi, mentalis",C
What action does the ﬂ exor carpi ulnaris perform?,it ﬂ exes the lower arm,the same as the extensor carpi ulnaris.,it ﬂ exes the ﬁ ngers,the same as the ﬂ exor carpi radialis,D
Which of the following is NOT a common intramuscular injection site?,gluteus medius,deltoid,gluteus maximus,vastus lateralis,C
Which of the following terms is used to describe the changing of large food molecules into smaller molecules?,mechanical digestion,deglutition,segmentation,hydrolysis,D
Which of the following does NOT contribute to increasing the surface area of the small intestine?,the brush border,plicae circulars,intestinal crypts,villi,C
Which layer of the gastro-intestinal tract is in contact with the contents of the gut?,Muscularis externa,Mucosa,Serosa,Sub-mucosa,B
Digestion of food molecules is necessary so that:,Indigestible food molecules are separated from digestible food molecules,Essential amino acids and fatty acids may be absorbed by the body,Excretion of waste products can occur via the bowel,Food may be converted into particles small enough to pass into the cells of the gut wall,D
What are the end products resulting from the digestion of carbohydrates?,monosaccharides,monoglycerols,pentose sugars,amino acids,A
Which layer of the alimentary canal is responsible for absorbing the products of digestion?,muscularis interna,mucosa,serosa,submucosa,B
What the products of hydrolysis of lipids?,monosaccharides,chylomicrons,amino acids and small peptides,free fatty acids and monoglycerols,D
The majority of dietary lipids are ingested in the form of,trisaccharides,tripeptides,cholesterol,triglycerides,D
One of the following statements is UNTRUE . Which one?,Glucose is produced during the manufacture of ATP,Glycogenolysis is the process of releasing glucose from glycogen 9 Gastro-Intestinal System 179,Gluconeogenesis is the conversion of amino acids to glucose,The monosaccharides galactose and fructose can be converted to glucose,A
Monosaccharides are the product of digestion of what substance?,proteins,carbohydrates,triglycerides,dipeptides,B
One of the following is NOT a function of the large intestine. Which one?,absorption of electrolytes,synthesis of some vitamins,absorption of water,digestion of fats.,D
Which of the following is NOT a function of the mucosa of the small intestine?,Protection against infectious disease.,Secretion of digestive enzymes.,The absorption of end products of digestion.,Segmentation.,D
A function of the LARGE intestine is to:,absorb the products of digestion,absorb water,participate in mechanical digestion,release intestinal gastrin,B
What is the process in the digestion of food molecules that produces their monomers called?,polymerisation,hydrolysis,isomerisation,deamination,B
Fatty acids are transported around the body by the blood in structures known as:,micelles,chylomicrons,triglycerols,low density lipoproteins,B
"The wall of the alimentary canal is made up of the four layers (not in any order): the muscularis externa, serosa, mucosa and sub-mucosa. Which layer absorbs the end products of digestion?",sub-mucosa,muscularis externa,serosa,mucosa,D
Which of the following is a function of the normal ﬂ ora of the large intestine?,To hydrolyse cellulose,To synthesise blood clotting proteins,To synthesise B vitamins and vitamin K,To secrete intrinsic factor,C
Fatty acids are absorbed from the gut into structures known as:,triglycerides,sinusoids,capillaries,lacteals,D
Which statement below about hormones is true?,Hormones are enzymes that catalyse reactions,Hormones are released into the blood circulation,Hormones affect all cells of the body,Hormones are released by neurones at synapses,B
What is the difference between an exocrine gland and an endocrine gland?,An endocrine gland secretes neurotransmitters (an exocrine gland does not).,An endocrine gland secretes via a tube to the destination (an exocrine gland does not).,An exocrine gland secretes into the blood (an endocrine gland does not).,An endocrine gland secretes into the blood (an exocrine gland does not).,D
What effect does aldosterone have?,It causes glucose to be absorbed from the blood,It cause Na + to be absorbed in the kidneys,It causes Ca ++ to be absorbed from the gut,It causes K + to be absorbed from the ﬁ ltrate.,B
What effect does aldosterone have? It causes:,angiotensin to be formed from angiotensinogen,Na + to be absorbed from the ﬁ ltrate,Na + and Ca ++ to be absorbed from the ﬁ ltrate and K + to be secreted into the ﬁ ltrate,Na + to be absorbed from the ﬁ ltrate and K + to be secreted into the ﬁ ltrate,D
To which group of hormones does aldosterone belong?,catecholamines,glucocorticoids,mineralocorticoids,gonadocorticoids,C
Which of the following statements about endocrine hormones is always true?,They are secreted by neurones,They are derived from amino acids,They are produced by exocrine glands,They are released into the bloodstream,D
Which one of the following is NOT produced by the kidneys?,Aldosterone,Renin,Erythropoietin,Calcitriol,A
By what name is the condition where nitrogenous wastes accumulate in the blood known?,anuria,uremia,polyuria,oliguriacv,B
The kidneys produce all of the following EXCEPT one. Which one?,erythropoietin,aldosterone,renin,active vitamin D,B
What is the role of aldosterone?,to convert angiotensinogen into angiotensin I.,to inhibit the absorption of Na + .,to promote the absorption of Na + .,to promote the absorption of Ca ++ .,C
One way to increase the glomerular ﬁ ltration rate is to dilate:,the afferent arteriole and to constrict the efferent arteriole.,the efferent arteriole and to constrict the afferent arteriole.,both the afferent arteriole and the efferent arteriole.,the efferent arteriole and to increase the permeability of the capillary endothelium.,A
The blood group known as the ABO system is based on the presence of what proteins on blood cells?,antibodies,antigens,agglutinins,immunoglobulins,B
What type of blood may a patient with blood type “B +” be infused with? Any blood that is,positive for rhesus antigen D,negative for rhesus antigen D,negative for antigen B,negative for antigen A,D
Which individuals can receive any type of blood and are considered universal recipients?,A+,O−,AB+,B−,C
Which characteristic of blood refers to the concentration of solutes?,salinity,pH,osmolality,viscosity,C
What does “Rhesus positive” refer to?,The presence of antigen D on the surface of red blood cells,The final factor involved in blood clotting,The presence of the rhesus antibody/agglutinin in the blood,A deficiency of Factor VIII that results in haemophilia,A
What can be said about a person who has the “A” antigen on their red blood cells?,their blood contains anti-B agglutinins,their blood contains anti-A agglutinins,their blood contains anti-A and anti-B agglutinins,their blood contains neither anti-A nor anti-B agglutinins,A
What substance is produced by the first step in the blood clotting (coagulation) process?,thrombin,prothrombin,factor X,prothrombinase,D
What are red blood cells also known as?,erythrocytes,thrombocytes,monocytes,eosinophils,A
"In blood clotting, what activates “factor X”",prothrombinase,thrombin,the extrinsic pathway,tissue plasminogen activator,C
Careful blood matching is performed prior to transfusing blood in order to avoid which scenario?,newborn haemolytic disease,the recipient’s antigens attacking the red blood cells in the transfusion,the recipient’s antibodies attacking the red blood cells in the transfusion,the antigens on the recipient’s red blood cells reacting with the antibodies in the transfused blood,C
What substance is the product of the second step in the blood clotting process?,thrombin,prothrombin,prothrombin activator,fibrin,A
A person whose blood group is “B positive” has which of the following?,"the rhesus D antigen and the B antigen on their rbc, and the anti-A agglutinin.","the rhesus D antigen and the B antigen on their rbc, and the anti-B agglutinin.","the rhesus D antigen and the A antigen on their rbc, and the anti-B agglutinin","no rhesus D antigen and the B antigen on their rbc, and the anti-A agglutinin",A
"If someone’s ABO blood group is “type A”, this means that",they have the type A antigen on their red blood cells,their blood contains anti-A agglutinins,they can receive blood from a type B donor,they may donate blood to a type B recipient,A
Which of the following formed elements of the blood is important in the forma- tion of clots?,erythrocytes,lymphocytes 12 Cardiovascular System 247,monocytes,thrombocytes,D
With which blood types can a person with blood type B be safely transfused?,A or AB,B or O,A or O,B or AB,B
The colloid osmotic pressure of blood is due to which of the following?,proteins in the blood,proteins in the interstitial fluid,sodium and chloride ions dissolved in blood,the water component of the blood,A
Which are the two most common types of white blood cells?,neutrophils and lymphocytes,erythrocytes and neutrophils,neutrophils and eosinophils,monocytes and lymphocytes,A
One of the following cells does NOT occur in blood. Which one?,erythrocytes,basophils,leucocytes,osteocytes,D
What would a person with type A blood also have?,antibody A,antigen A,agglutinin A,agglutinogen B,B
Which structure has the thickest wall?,the aorta,the inter-atrial septum,the left ventricle,the right ventricle,C
Complete the sentence correctly. The left ventricle pumps:,more blood than the right ventricle,blood at a lower pressure than the right ventricle,less blood than the right ventricle,blood at a higher pressure than the right ventricle,D
What is it called when plaque dislodges from a lesion in a blood vessel wall and then moves “downstream” to lodge in the capillary bed feeding the digestive tract? We call this a:,Myocardial infarction,Stroke 12 Cardiovascular System 267,Pulmonary embolism,Mesenteric embolism,D
Exchange between the blood and the interstitial fluid occurs most readily through which type of capillary?,venules,fenestrated capillaries,sinusoids,arterioles,C
The wall of a capillary consists of one layer (or coat). What is it called?,tunica intima,tunica externa,lamina propria,tunica media,A
What can be said about the endothelium of fenestrated capillaries?,the endothelial cells have pores (windows) to allow rapid movement of sol- utes and water.,gaps between adjacent endothelial cells allow free exchange between blood and interstitial fluid.,their tunica intima is composed of a complete lining of endothelial cells.,They do not have an endothelium.,A
Fenestrated capillaries permit the exchange of nutrients and wastes between cells and the blood because of which feature of their structure?,gaps between adjacent endothelial cells allow free exchange between blood and interstitial fluid.,they are in close proximity to most cells.,their tunica intima is composed of a single layer of endothelial cells.,their endothelium has pores (windows) to allow the rapid movement of water and solutes.,D
Capillaries permit the exchange of nutrients and wastes between cells and the blood because of which feature of their structure?,adjacent endothelial cells are separated by gaps which allow free exchange between blood and interstitial fluid.,they are in close proximity to most cells.,"they have a single layer, the tunica intima, consisting of a single layer of endothelial cells in their walls.",their endothelial cells have pores (windows) to allow the rapid movement of water and solutes.,C
Which tunic(s) are ABSENT from the walls of blood capillaries?,tunica intima,tunics externa and intima,tunics media and externa,tunics interna and media,C
The pressure inside a working suction bottle is most likely to be,,740 mmHg,760 mmHg,780 mmHg,800 mmHg
"The volume of gas trapped within a space will increase as pressure decreases, the physics law that refers to this is:",Henry’s law,Poiseuille’s law,Hugh’s law,Boyle’s law,D
Increasing the number of red cells per millilitre of blood will:,increase the viscosity and increase the rate of flow of the blood,decrease the viscosity and increase the rate of flow of the blood.,increase the viscosity and decrease the rate of flow of the blood.,decrease the viscosity and decrease the rate of flow of the blood.,C
A scuba diver swimming at a depth of 10 m will experience a pressure of how many atmospheres?,1,2,3,1.5,B
100 mmHg pressure equates to how many cm of water?,134,13.4,760,76,A
"A suction pump when used to clear an obstructed airway, expands the volume in its chamber to",produce a negative pressure and obstructing liquid is pushed out by air pres- sure in the lungs,produce a positive pressure and obstructing liquid is pushed out by air pres-sure in the lungs 12 Cardiovascular System 277,produce a negative pressure and obstructing liquid is sucked up into the chamber,produce a positive pressure and obstructing liquid is sucked by atmospheric pressure into the chamber,A
"A walker carried a balloon filled with 10 L of air, from sea level (where the atmospheric pressure was 101 kPa), up a mountain to a height of 3000 m (where the atmospheric pressure was 70 kPa). What would be the approximate volume of the balloon at 3000 m?",7 L,10 L,14 L,30 L,C
"Approximately how much pressure does a science lecturer who has a mass of 70 kg and is standing on one foot (which has an area of 0.0165 m 2), exert on the ground? (acceleration due to gravity is 10 m/s2)",4.2 kPa,42 kPa,420 kPa,2.4 × 10−5 Pa,B
Using “suction” to drain fluid is described correctly by which choice below? Creating a:,positive pressure so that it can suck the fluid in the direction of the positive pressure.,negative pressure so that it can push the fluid towards the positive pressure.,negative pressure so that atmospheric pressure will push the fluid towards the negative pressure.,positive pressure so that atmospheric pressure will push the fluid towards the positive pressure.,C
Pressure is a quantity derived from force and the area in contact with the force. What is it that pressure measures?,the force being exerted on an area.,the force divided by the area.,the force multiplied by the area.,the force divided by the area squared.,B
