question,optionA,optionB,optionC,optionD,answer
Which of the following would happen when hydrochloric acid is added to water?,the acid would react with water to from a low concentration of hydronium ions.,the acid would react with water to from a high concentration of hydroxide ions.,the acid would react with water to from a high concentration of hydronium ions.,the acid would react with water to from a high concentration of bicarbonate ions.,C
"If the pH of the stomach contents changed from 3 to 2, which of the following is true?","at pH 2, the concentration of hydronium ions is two thirds of the concentra- tion at pH 3.","at pH 3, the concentration of hydronium ions is 50 % more than the concen- tration at pH 2.","at pH 2, the concentration of hydronium ions is ten times the concentration at pH 3.","at pH 3, the concentration of hydronium ions is ten times the concentration at pH",C
The carbonic acid and bicarbonate buffer system is one if the buffers that help to maintain the blood’s pH within the healthy range by doing which of the following?,carbonic acid destroys excess base in the blood while bicarbonate destroys excess acid.,carbonic acid destroys excess acid in the blood while bicarbonate destroys excess base.,carbonic acid and bicarbonate destroy excess acid.,carbonic acid and bicarbonate destroy excess base.,A
"In a solution like blood that is buffered to minimise changes in pH, what deter - mines the pH of the solution?",the concentration of the hydronium ions,the logarithm of the concentration of the hydronium ions,the ratio of the concentration of hydronium ions to hydroxide ions.,the ratio of the concentrations of the two components of the buffer.,D
"When in solution, an acidic drug also exists as its salt. What feature does the salt of a drug have that may not be shared by the acid form of the drug?",The salt of the drug does not carry an electrical charge but the acid form does.,The salt of the drug may be more soluble in lipid than the acid form of the drug.,The acid form of the drug is ionised whereas the salt is not.,The salt of the drug may be more soluble in water than the acid form of the drug.,D
Which one of the following best defines an acid?,an aqueous solution with a pH of less than 7.0,a substance that reacts with water to produce hydrogen ions,a substance that reacts with water to produce hydroxide ions,a substance that reacts with water to produce hydronium ions,D
Which one of the following acids is not normally found in the body?,hydrochloric acid,carbonic acid,nucleic acid,acetylsalicylic acid,D
Which statement about the phosphate buffer is correct?,H 2PO 42− destroys acid and HPO 4− destroys base,H2PO 42− destroys base and HPO 4− destroys acid,H2PO 42− is basic and HPO 4− is acidic,the ratio of H 2PO 42− : HPO 4− decreases following the addition of acid.,B
"Three of the solutions below have the SAME level of acidity (or alkalinity), the other is different. Which is the different one?",blood,a neutral solution,a solution with pH = 7,a solution with a hydrogen ion concentration of 10 -7 mol/L,A
Which of the following statements is a definition of a buffer solution?,one where the number of osmoles of solute equals the number of moles.,one where the concentration of hydronium ions equals the concentration of hydroxide ions.,a solution that resists change to its pH.,a solution that reacts partly with water to produce a relatively low concen-tration of hydronium ions.,C
Which of the following solutions is the most acidic?,blood plasma,gastric juice,a solution with pH = 7,a solution with hydronium ions at a concentration of 10 -5 moles/L,B
Pure water contains small but equal amounts of hydronium (H 3O+) ions and hydroxide (OH−) ions. This means that water is:,acidic,basic,acidic and basic,neither acidic nor basic,D
"What do we call a substance that when added to water, reacts with water to produce hydronium ions?",an ionic compound,a base,an electrolyte,an acid,D
How does the blood’s phosphate buffer behave when an hydronium ion is encountered?,HPO 42− destroys the hydronium ion and becomes H 2PO 4- – and blood pH decreases very slightly,H2PO 4- destroys the hydronium ion and becomes HPO 42− and blood pH decreases very slightly,HPO 42− destroys the hydronium ion and becomes H 2PO 4- and blood pH increases very slightly,H2PO 4- destroys the hydronium ion and becomes HPO 42− and blood pH increases very slightly,A
One of the statements below about buffers is correct. Which one?,a buffer consists of an acid and a base.,a buffer will react with water to produce hydronium ions.,a solution that is neither acidic nor basic is called a buffer.,the components of a buffer are conjugate pairs.,D
An acid may be defined as a substance that:,reacts completely with water producing a high concentration of hydronium ions,reacts with water to produce hydroxide ions,produces a pH of more than 7 when in solution,reacts with water to produce hydronium ions,D
One of the statements below about buffers is WRONG. Which one?,a buffer consists of a weak acid and its slightly basic salt.,a buffer will react with water to produce hydronium ions.,a solution that resists change to its pH is called a buffer.,the components of a buffer are conjugate pairs.,B
An acid may be defined by which one of the following statements?,a substance with equal concentrations of hydronium and hydroxide ions.,a substance that reacts partly with water to produce hydronium ions,a substance that maintains the pH of the solution it is in.,a substance that reacts with water producing hydroxide ions.,B
Which of the following defines an acid?,"when in solution, resists change to pH",reacts with water to produce hydronium ions,reacts with a buffer to produce water,has a pH of more than,B
Which of the following is NOT an acid?,a solution having a pH of 3.,a substance which reacts with water to produce hydronium ions.,carbonic acid.,a solution that resists change to its pH,D
What effect would a base have when added to the following solutions?,Tap water: – it would react to produce hydronium ions.,Tap water: – it would react to produce hydroxide ions.,Buffered water: – it would raise the pH of the solution.,Un-buffered water: – it would lower the pH of the solution.,B
What effect would an acid have when added to the following solutions?,Tap water: – it would react to produce hydronium ions.,Tap water: – it would react to produce hydroxide ions.,Buffered water: – it would lower the pH of the solution. 4 Chemistry for Physiology 91,Un-buffered water: it would raise the pH of the solution.,A
A fresh sample of blood (a buffered solution) is withdrawn from the body and its pH measured at 7.4. A small quantity of strong acid (as an isotonic solution) is added to it. Which of the following values is most likely to be the pH of the resulting blood solution?,3,7.3,7.4,7.5,C
Blood in the body is different to a buffered solution held in a beaker. This is because hydronium (hydrogen) ions can be removed from solution in blood almost immediately by:,filtration in the kidney from where it is eliminated from the body in urine.,combining with hydroxide ions to form water which is eliminated as urine.,combining with bicarbonate to form carbonic acid which disassociates to water and carbon dioxide which is breathed out.,reacting with mono-hydrogen phosphate to form di-hydrogen phosphate.,C
The definition of an acid is a substance that reacts:,completely with water to produce a large concentration of hydronium ions.,with water to produce hydroxide ions.,with a base to produce a neutral salt.,with water to produce hydronium ions.,D
Choose the INCORRECT statement about buffer solutions.,the pH of a buffer does not change on addition of acid or base.,a buffer has two components which may be a weak acid and its salt.,a buffer has two components which may be a weak base and its salt.,pH of a buffer depends only on the ratio of its components.,A
"As the blood becomes more acidic, hydrogen (hydronium) ions combine with bicarbonate ions to form carbonic acid which in turn dissociates into carbon dioxide (to be breathed out by the lungs) and water. Which is the equation describing this reaction?",CO HO HCOH HCO22 23 3 +← ←++−,CO HO HCOH HCO22 23 3 +→ →++−,CO HO HH CO HCO22 32 3 +← +←+−,HH CO CO HO HCO+−+← +←32 22 3,A
"A buffer solution consisting of H 2PO 4− (acid) and HPO 42− (base), in a ratio of 1:4, maintains the pH at 7.4. What is the ratio of these two components if the pH were to become 8.4 after the addition of more of the basic component of the buffer?",1:5,2:4,1:8,1:40,D
Which of the following pH values would you expect to a dilute solution of a weak base to have?,2.4,6.2,8.2,12.4,C
A buffer solution having a pH of 8.5 has a small amount of strong acid added to it. What is its pH value likely to be closest to? 4 Chemistry for Physiology 93,5,8.4,8.6,12.4,B
Which of the following statements about the role of the kidneys or lungs in the maintenance of acid-base balance within the body is FALSE?,The kidneys are able to affect several buffer systems but the lungs affect only one.,The lungs exert their influence on the carbonic acid/bicarbonate buffer system.,Neither the lungs nor the kidneys have much influence over the protein buffer.,The kidneys are able to respond more rapidly than the lungs to changes in acid- base balance.,D
Denaturation of proteins involves disruption of the,primary structure,secondary structure,tertiary structure,covalent bonding,C
Amino acids are the building blocks of all proteins. As more amino acids are added the protein chain tends to fold upon itself in a characteristic way. This characteristic of a protein is called the:,primary structure,secondary structure,tertiary structure,quaternary structure,C
Which of the following is the correct combination for the nucleic acid DNA?,"Phosphate, Ribose, Uracil","Phosphate, Deoxyribose, Uracil","Phosphate, Ribose, Adenine","Phosphate, Deoxyribose, Adenine",D
Which one of the following is NOT a steroid compound?,stearic acid,oestrogen,cholesterol,testosterone,A
Which of the following foods when catabolised in the body produces the high-est yield of energy?,100 gram of fat,100 gram of chocolate,100 gram of carbohydrate,100 gram of protein4.6 Organic Chemistry and Macromolecules 96,A
Fructose is a simple sugar or carbohydrate. What is it an example of? A:,monosaccharide,disaccharide,polysaccharide,oligosaccharide,A
"A lipid such as oleic acid contains a number of double bonds in the carbon chain. Because of this, what term is applied to it?",monounsaturated,diunsaturated,polyunsaturated,saturated,C
Which of the following chemical formulae represents a typical carbohydrate?,Ca 10(PO 4)6(OH) 2,N2C5H12O4,C120H240O120 4 Chemistry for Physiology 97,C57H110O6,C
Which of the following refers to a carbohydrate?,diglycerol,adenosine diphosphate,disaccharide,dipeptide,C
What are the bonds that maintain the secondary and tertiary structure of proteins?,hydrogen bonds,covalent bonds,ionic bonds,peptide bonds,A
Which of the following formulae would be most likely to represent a lipid?,C 2936H4624N786O889S41,C57H110O6,C6H12O6,Ca10(PO 4)6(OH) 2,B
To what type of fatty acids is the term “saturated” applied?,Those with four single bonds around each carbon atom.,Those with at least one double bond between carbon atoms.,Those that are not implicated in coronary heart disease.,Those which are essential in our diet.,A
Which of the following is a polysaccharide?,glucuronidase,glucagon,glucose,glycogen,D
What holds the primary structure of a protein together?,hydrogen bonds,covalent bonds,peptide bonds,ionic bonds,C
What is a “saturated fat”?,one that contains cholesterol,a triglyceride that has three fatty acids,one where the carbon atoms that are connected by single bonds 4 Chemistry for Physiology 99,one that must be included in our diet,C
In what form is most of the lipid component of our food in?,triglycerols,polysaccharides,complex carbohydrates,polypeptides,A
"In organic compounds, How many bonds do carbon atoms always form?",four single bonds,four covalent bonds,two double bonds,four ionic bonds,B
A molecule of an organic compound can be thought of as having two portions: a radical with an attached functional group. What is the correct definition of a functional group?,it consists of carbon atoms and hydrogen atoms,it is responsible for most of the properties of the molecule.4.6 Organic Chemistry and Macromolecules 100,it has a modest influence on the properties of the molecule.,it consists of a ring of carbon atoms.,B
"When a protein is denatured, which aspect of its structure is affected the LEAST?",primary structure,secondary structure,tertiary structure,quaternary structure,A
What chemical symbol for the element/atom occurs in an amino acid but not in fats and carbohydrates?,N,H,O,C,A
The element carbon is said to be tetravalent. This means it always has the fol-lowing number of covalent bonds in neutral compounds.,one,two,three,four,D
Which of the following structures represents a molecule belonging to the alco- hol family?,CH 3 – COOH,CH 3 – OH,CH 3 – O – CH 3,CH 3 – CO – CH 3,B
A hydrocarbon is a type of compound that contains:,Only carbon atoms,Carbon and Hydrogen atoms,"Carbon, Hydrogen and Oxygen atoms",Water and carbon atoms,B
A hydrocarbon molecule which contains at least one double bond could be an example of which type of compound:,Alkane,Alkene4.6 Organic Chemistry and Macromolecules 102,Alkyne,Alcapone,B
Which of the following structures represents a molecule belonging to the ketone family?,CH 3–CO–NH 2,CH 3–NH 2,CH 3 – O – CH 3,CH 3 – CO – CH 3,D
What is the sequence of amino acids in a protein known as?,primary structure,secondary structure,tertiary structure,quaternary structure,A
Which one of the following structure represents a saturated organic compound?,O ǁ CH3CH2C─OH,CH 3CH 2OH,CH 3CHCHCH 3,CH … CH,B
What is the protein that ﬁ lls the outermost dead cells of the epidermis?,granstein,dermin,melanin,keratin,D
What must be the case for a drug to be administered transdermally?,It must be water soluble,It must be lipid soluble,It must be injected subcutaneously,It must not irritate the skin’s chemo-receptors.,B
The skin participates in the production of vitamin D when which of the follow- ing occurs? When,calcium is present,signalled to by the hormone PTH,exposed to ultraviolet radiation,the precursor molecule is produced by the liver,C
The skin begins the production of vitamin D in which of the following situa- tions? When,exposed to ultraviolet radiation.,signalled to by the hormone PTH,calcium is present,it adds an hydroxyl group to a cholesterol molecule.,A
The hypodermis is which of the following?,the outer layer of the skin.,the inner layer of the skin.,the superﬁ cial fascia and not regarded as part of the skin.,"not vascularised, getting its nutrients by diffusion.",C
People with full thickness burns to more than 20 % of their body are in a life- threatening situation. This is due to which of the following?,The body’s inability to thermoregulate.,The loss of the ability to produce vitamin D.,The buildup of urea and uric acid which would otherwise have been excreted by the skin.,C. The buildup of urea and uric acid which would otherwise have been excreted by the skin. D. The body’s inability to prevent water loss,D
What is the most common protein in the epidermis?,elastin,keratin,melanin,cholesterol,B
What is the ﬁ brous protein in our skin that protects it from abrasion?,melanin,keratin,sebum,elastin,B
Which protein(s) are found in thin myoﬁ laments?,actin,actin and tropomyosin,"actin, tropomyosin, and troponin","actin, myosin, tropomyosin and troponin",C
What causes the myosin binding site of an actin molecule to be exposed?,ATP attaching to the myosin cross-bridge,a nerve impulse reaching the motor end plate of a motor nerve.,calcium ions attaching to troponin,acetylcholine crossing the neuromuscular junction,C
What is the role of calcium ions in muscle contraction? To,"bind to troponin, thus changing its shape and pulling it away from the actin molecule.",cause the myosin cross-bridge to detach from its binding site.,cause the action potential to propagate along the sarcolemma.,bind with ADP during aerobic respiration to produce ATP to provide energy.,A
The energy for muscle contraction is derived from the mechanisms below EXCEPT for one. Which one is NOT a method of producing ATP?,anaerobic glycolysis.,aerobic respiration. 8 Muscles 158,direct phosphorylation of ADP by creatinine phosphate.,anaerobic digestion of lactic acid.,D
Which of the following statements is WRONG ? The end products of:,protein digestion are transported to the liver via the hepatic portal vein,triglyceride digestion are transported to the liver via the lymphatic system,carbohydrate digestion are transported to the liver in the blood,triglyceride digestion are transported via the lymphatic system,B
What are the end products of carbohydrate digestion?,chylomicrons,amino acids,free fatty acids,monosaccharides,D
Which of the following pairs of substances are NOT secreted by the stomach as part of “gastric juice”?,hydrochloric acid and pepsinogen,hormones and intrinsic factor,nuclease and amylase,mucus and gastrin,C
What are some products of lipid digestion?,free bases and pentose sugars,fructose and glucose,amino acids and small peptides,free fatty acids and monoglycerols,D
Which of the following is a function of the liver?,Recycling of non-viable red blood cells,Conversion of pyruvic acid to lactic acid,Synthesis of plasma proteins,Production of renin,C
What is the term applied to the production of glucose from non-carbohydrate molecules?,deamination,transamination,glycogenolysis,gluconeogenesis,D
What is the purpose of “intrinsic factor” in gastric juice?,to activate pepsinogen,to assist with the absorption of vitamin B12,to protect the stomach lining against hydrochloric acid,it stimulates the release of gastrin,B
What are the end-products of carbohydrate digestion?,monosaccharides,disaccharides,glucose,trisaccharides,A
To what does the term “gluconeogenesis” refer?,the conversion of glycogen to glucose.,the removal of an amine group from an amino acid.,the production of glucose from non-carbohydrate molecules.,the conversion of disaccharides to monosaccharides.,C
Which of the following substances is NOT produced by the cells of the gastric glands?,mucus,hydrochloric acid,gastrin,pepsin,A
What molecules are the products of protein hydrolysis?,Monoglycerols and free fatty acids,Monosaccharides and disaccharides,Amino acids,Amino acids and small peptides,D
Which enzyme below digests proteins?,nuclease,maltase,carboxypeptidase,transaminase,C
To what does the term “gluconeogenesis” refer?,the conversion of non-carbohydrate molecules to glucose,the formation of non-essential amino acids from a keto-acid,the removal of an amine group from a molecule,the release of glucose from stored glycogen,A
Which of the following could NOT be used to describe pepsinogen?,it is a protein,it is a hormone,it is related to an enzyme,it is inactive,B
What is the function of the oesophagus in digestion?,It is a site of mechanical digestion.,It transfers food from the mouth to the stomach.,The oesophagus secretes amylase to begin carbohydrate digestion.,the oesophagus secretes hydrochloric acid.,B
What food is digested into monoglycerols?,protein,lipid,nucleic acid,starch,B
Which is an enzyme secreted by the gastric glands?,pepsin,gastrin,Cholecystokinin,intrinsic factor,A
What are the products of protein digestion?,monoglycerols and fatty acids,"dipeptides, tripeptides and amino acids","bases, pentose sugars and nitrate ions",monosaccharides and disaccharides,B
Correctly complete the sentence: Pepsinogen is,converted to pepsin by hydrochloric acid,converted to pepsin by intrinsic factor,secreted by the pancreas,involved in production of carbohydrate digesting enzymes 9 Gastro-Intestinal System 173,A
Protein is digested to polypeptides by which of the following?,pepsinogen,intrinsic factor 9 Gastro-Intestinal System 174,hydrochloric acid,pepsin,D
What are the products of carbohydrate digestion?,monosaccharides,amino acids,monoglycerides,monogylcerols,A
Which of the following are the end products of protein hydrolysis?,monoglycerols,keto acids and non-essential amino acids,polypeptides,amino acids and di- and tripeptides,D
One of the following is NOT a function of the liver. Which one?,recycling of red blood cells,storage of fat soluble vitamins 9 Gastro-Intestinal System 175,removal and recycling of lactic acid,activation of vitamin D,A
What converts pepsinogen to pepsin in the stomach?,hydrochloric acid,gastrin,intrinsic factor,pepsinase,A
Which of the following is a function of bile?,To attach to vitamin B12 to allow it to be absorbed.,"To activate trypsinogen, chymotrypsinogen and procarboxypeptidase.",To digest fats.,To disperse large lipid globules into smaller droplets.,D
Which of the following is an enzyme?,amylase,gastrin,intrinsic factor,pepsinogen,A
What pancreatic enzyme digests lipids to free fatty acids and monoglycerides?,lipase,bile,cholecystokinin,lingual lipase 9 Gastro-Intestinal System 181,A
What stomach enzyme digests protein to polypeptides?,pepsin,hydrochloric acid,gastrin,intrinsic factor,A
What are the products of protein digestion?,polypeptides,monosaccharides,amino acids,free fatty acids and monoglycerides,C
What is the name of the hormone that stimulates the stomach to secrete hydro- chloric acid?,gastrin,intestinal gastrin,secretin,cholecystokinin,A
The functions of the stomach are:,"storage of meal, digestion of protein, mechanical digestion.","mechanical digestion, digestion of carbohydrate, food storage.","churning of chyme, digestion of fats, mechanical digestion. 9 Gastro-Intestinal System 185","digestion of protein, absorption of glucose, storage, mechanical digestion.",D
Which digestive enzyme in pancreatic juice digests proteins?,trypsin,lipase,pepsin,amylase,A
Which digestive enzyme in saliva breaks down starch?,trypsin,lipase,pepsin,amylase,D
Which one of the listed molecule types are absorbed from the gut?,starch,monosaccharides,cellulose,polypeptides,B
What are the products of carbohydrate digestion?,free bases and pentose sugars,monosaccharides 9 Gastro-Intestinal System 188,cellulose and disaccharides,free fatty acids and monoglycerides,B
What is a function of the SMALL intestine? To:,temporarily store ingested food,absorb the products of digestion,participate in mechanical digestion,secrete hydrochloric acid,B
What is produced by the beta cells of the pancreas?,angiotensin converting enzyme,glucocorticoids,glucagon,insulin,D
By what term are hormones derived from tyrosine also known?,amino acid derivatives,peptide hormones,steroid hormones,corticosteroids,A
Which hormone has the element iodine as part of its molecule?,calcitonin,haemoglobin,thyroxine,parathyroid hormone,C
Which of the following is an amino acid derivative hormone?,epinephrine,tyrosine,testosterone,prostaglandin,A
Peptide hormones are produced (and/or released) by which structure?,The adrenal cortex,The gonads,The hypothalamus,The kidneys,C
"What type of molecule is cAMP, or what role does it play?",a second messenger,an amino acid based hormone,a catecholamine,a steroid hormone,A
The hormones thyroxine and tri-iodothyronine contain which element?,cobalt,iron,iodine,manganese,C
Which of the following statements about corticosteroids is true?,They may also act as neurotransmitters,They are transported dissolved in blood,They are produced by the adrenal gland,They are amino acid derivatives,C
What is the difference between endocrine glands and exocrine glands?,endocrine glands produce hormones whereas exocrine glands do not.,exocrine glands secrete into the blood stream whereas endocrine glands do not.,endocrine glands are controlled by the autonomic nervous system whereas exocrine glands are not.,exocrine glands secrete steroid hormones whereas endocrine glands secrete amino acid-based hormones.,A
What molecule catalyses the formation of angiotensin I?,carbonic anhydrase,calcitriol,erythropoietin,renin,D
What is the kidney tubule’s response to a rise in blood pH?,Bicarbonate ions are created from carbonic acid and absorbed into the blood.,"Hydronium ions are secreted into the ﬁ ltrate, where they are buffered by bicarbonate ions in the ﬁ ltrate.","Bicarbonate ions are secreted into the ﬁ ltrate, while hydronium ions are absorbed from the ﬁ ltrate into the blood.","Hydronium ions are secreted into the ﬁ ltrate, while bicarbonate ions are absorbed from the ﬁ ltrate into the blood.",C
The kidneys produce all of the following EXCEPT one. Which one?,erythropoietin,angiotensinogen,hydronium ions,bicarbonate ions,B
The kidney produces all but one of the following. Which one?,calcitriol,atrial natriuretic peptide,renin,bicarbonate ions,B
The kidneys produce all of the following except one. Which one?,the enzyme renin,the hormone erythropoietin,antidiuretic hormone,the vitamin calcitriol,C
Complete the following sentence correctly. Atrial natriuretic peptide,causes the wall of the collecting duct of the nephron to increase in perme- ability to water,increases sodium (Na + ) excretion at the kidneys.,causes peripheral vasoconstriction,stimulates the adrenal glands to release aldosterone,B
Under what conditions will the kidney produce concentrated urine? If:,glomerular ﬁ ltration rate is low.,glomerular ﬁ ltration rate is high. 11 Renal System 234,atrial natriuretic peptide and aldosterone are present in blood.,antidiuretic hormone and aldosterone are present in the blood.,D
Which one of the following is a function of the renal system?,produce bile,produce the enzyme renin,produce the hormone aldosterone,produce vitamin K,B
