question,optionA,optionB,optionC,optionD,answer
Which one of the following statements best describes DNA?,"single stranded, deoxyribonucleic acid","single stranded, ribonucleic acid","double stranded, deoxyribonucleic acid","double stranded, ribonucleic acid",C
"The combination of a sugar, a base and at least one phosphate group is given the general term of:",nucleoside,amino acid,polypeptide,nucleotide,D
Which of the following is the correct combination of the components for the nucleic acid DNA?,"Phosphate, Ribose, Uracil","Phosphate, Deoxyribose, Proline","Phosphate, Ribose, Thymine","Phosphate, Deoxyribose, Adenine",D
Which of the base pairings in DNA would be correct?,A–T pair,A–G pair,C–T pair,C–A pair,A
The combination of a sugar and a base is given the general term of:,nucleoside,amino acid,polypeptide,nucleotide,A
Which of the following is the correct combination of the components for the nucleic acid RNA?,"Phosphate, Ribose, Uracil","Phosphate, Deoxyribose, Proline","Phosphate, Ribose, Thymine","Phosphate, Deoxyribose, Adenine",A
"The chemical formula C 6H12O6 contains much information. However, what information is NOT provided by the formula?",the number of atoms in a molecule,the name of the substance 44,the elements that make up the substance,whether the substance is covalent or ionic,B
Which of the particles listed below is the smallest?,an atom,a proton,an ion,a molecule,B
A molecular compound may be defined by which of the following?,atoms from non-metal elements covalently bonded.,atoms from metal elements covalently bonded,atoms from metal elements and non-metal elements covalently bonded,atoms from non-metal elements ironically bonded,A
Many drugs are neutralised to form salts and administered in this form. What is the main advantage of administering the salt form of the drug? It is usually:,less toxic,more soluble in water,more pleasant to taste,more soluble in lipid,B
Choose the correct statement about hydrogen bonds. They,are stronger than covalent bonds.,"act between the H in one –OH or –NH group, and the O or N in another.",operate within molecules.,"act between the H in one –OH or –NH group, and the H in another.",B
"Given that the atomic mass of nitrogen is 14 and of hydrogen is 1, what is the mass in grams of one mole of ammonia (NH 3)?",15,16,17,18,C
"Choose the ending that will correctly complete the sentence: When atoms of a metal element and atoms of a non-metal element react, the result is",a covalent compound consisting of molecules,a covalent compound consisting of ions,an ionic compound consisting of ions in a lattice,an ionic compound consisting of molecules in a lattice,C
"In a water molecule, the bond between oxygen (O) and hydrogen (H) is",a covalent bond and a polar bond,an ionic bond,a covalent bond,an ionic bond and forms an electrolyte,A
Molecules are relatively easy to separate from one another. This means that the bonds between them are:,ionic,covalent,relatively weak,relatively strong,C
What happens when a sodium atom reacts to form a compound? The atom will,gain one electron,lose one electron,gain two electrons,lose two electrons,B
"When nitrogen combines with hydrogen to form a compound, its formula will be:",NH 3,N3H,NH 4,NH,A
Which of the following type of bond between atoms is the weakest?,ionic bond,polar bond,covalent bond,hydrogen bond,D
"Ionic, non-molecular compounds are likely to have which of the following sets of properties?","high melting point, often soluble in organic liquids, in pure form do not conduct electricity.","low melting point, no strong odour, soluble in water, electrical conductivity in solution.","high melting point, electrical conductivity in solution, no strong odour, often soluble in water","low melting point, strong odour, soluble in organic liquids, in pure form do not conduct electricity.",C
Which of the following best describes a molecule?,The simplest structure in an ionic compound.,One thousandth of a mole.,The particles of which covalent compounds are composed.,The smallest particle of an element.,C
Which of the following symbols represents a chemical element?,O,CO,CO 2,H3O+,A
What is the name given to the particles that make up a covalent compound?,ions,molecules,anions and cations,metal atoms,B
"Given that one mole is 6 × 1023 particles, how much is a millimole?",6 × 1020 particles,106 mole,10-6 mole,6 × 10-3 particles,A
Which of the following is a definition of a molecule? The particle that composes:,covalent compounds,non-metal elements,electrolytes,ionic compounds,A
What is the smallest particle of a non-metal element known as?,a molecule,an atom,an ion,a neutron,B
What is the difference between ions and molecules?,ions have an electrical charge whereas molecules do not.,ions are from metal elements only whereas molecules contain only non- metal elements,"ions arise from compounds between non-metal elements, whereas mole-cules arise from metal and non-metal elements",an ion may be formed from a single atom but molecules always involve more than one atom,D
Of the four different types of matter listed below which is not an example of an element?,hydrogen,oxygen,water,gold,C
"A certain pure substance, A, when heated is changed into two quite different pure substances, C and D. Which of the following statements must be true?",A is a compound.,C and D are not elements.,"A, C and D are all compounds.","Which of the following statements must be true? A. A is a compound. B. C and D are not elements. C. A, C and D are all compounds. D. C and D are elements.",A
In which of the following sequences are particles listed in order of increasing size from left to right?,"electron, atom, proton, molecule","molecule, atom, proton, electron","atom, proton, electron, molecule","electron, proton, atom, molecule",D
Which of the following is the name of a subatomic particle?,anion,cation,molecule,neutron,D
Which of the following represen- tations of the bonding in a molecule of nitrogen is correct?,N+ N-,N–N,N=N,N≡N,D
"Which of the following properties is least likely to be possessed by a covalent, molecular substance?",strong odour,high solubility in water,melting point above 400 °C,low electrical conductivity,C
The diagrams below display the covalent bonds present in a series of simple molecules. In which case is the number of bonds surrounding an atom in the diagrams below INCORRECT?,"Carbon dioxide, O – C – O","carbon tetrachloride, CI CI CICI CI","ammonia, H HH N","water, H – O – H",A
"Given that one mole of Na+Cl− has a mass of 58.5 g, how many grams of Na+Cl− are dissolved in a solution of 0.1 mole per litre?",0.585 g,5.85 g,58.5 g,0.1 g,B
What is the percentage concentration of glucose if 80 gram of glucose is dis- solved in one litre of solution?,0.8 %,5 %,8 %,80 %,C
"Given that the concentration of hydronium ions in a solution with pH of 2 is 0.19 %, what would be the concentration of hydronium ions in a solution with pH of 3?",0.13 %,0.29 %,0.019 %,1.9 %,C
What does the term “electrolyte” refer to?,an uncharged dissolved particle.,the smallest particle of an element.,a substance that will conduct electricity when dissolved in water.,negatively charged sub-atomic particles.,C
What is meant by referring to a solution concentration of 0.18 %?,0.18 g of solute in 100 ml of solution.,1.8 g of solute in 100 ml of solution.,0.18 g of solute in one litre of solution.,0.18 mole of solute in 100 ml of solution.,A
Which of the following is NOT an electrolyte (or does not contain electrolytes)?,Cl −,acetic acid,glucose,a 0.9 % solution of sodium chloride,C
"If the concentration of a solution is 5 %, which of the following is true?",There is 0.5 g of solute per 100 ml of solution,There is 5 g of solute per 100 ml of solution,There is 5 g of solute per 1000 ml of solution,There is 50 g of solute per 100 ml of solution,B
What does the term “electrolyte” refer to?,the minor component of a solution.,a substance that will conduct electricity when dissolved in water. 4 Chemistry for Physiology 55,the smallest particle of an element.,negatively charged sub-atomic particles.,B
The solution concentration 0.9 % means that there are,0.9 g of solute in 100 ml of solution.,9.0 g of solute in 100 ml of solution.,0.9 g of solute in one litre of solution.,0.9 mole of solute in 100 ml of solution.,A
Which of the following is NOT an electrolyte (or does not contain electrolytes)?,K+,nitrate ions,haemoglobin,a 1 % solution of sodium chloride,C
Which is the best definition of an electrolyte?,an atom that dissociates into ions.,a substance that will conduct electricity when it is dissolved in water.,"molecules of solid, liquid or gas that will conduct electricity in solution.",a substance that will conduct electricity.,B
"A solution of 5 % glucose is used for an infusion. Over a 2 hour period, 300 ml of the solution were used. How much glucose in grams was infused?",5 gm,12.5 gm,15.0 gm,50 gm,C
A solution of glucose is used for an infusion. Over a 3 hour period 250 ml of solution is used containing a total of 5 g of glucose. What is the concentration of the glucose solution used?,2 %,20 %,0.2 %,5 %,A
Which of the following statements relating to a patient with severe loss of potassium due to diuretic abuse is TRUE?,the serum levels of potassium are > 3 mmol/L,an ECG is probably not warranted,the condition may be treated by administering oral glucose and potassium,one course of action is to decrease the intake of potassium and to undergo ion-exchange resin treatment,C
Which strategy would be most effective in dealing with a severe case of dehydration?,Oral administration of a hypertonic solution.,Intravenous administration of distilled water.,Intravenous administration of isotonic glucose.,Intravenous administration of hypotonic sodium chloride.,C
A common IV solution is the combination 0.18 % sodium chloride and 4 % glucose (also called “4 % and a fifth”). How many grams of each solute will be in a one litre bag?,0.18 g of sodium chloride and 4 g of glucose.,0.9 g of sodium chloride and 5 g of glucose,1.8 g of sodium chloride and 40 g of glucose,18 g of sodium chloride and 40 g of glucose,C
Which general description of the components of a solution is correct?,solvent and solute,solvent and liquid,solute and solder,liquid and solid,A
Which term below is NOT suitable to describe the concentration of a solution?,5 g/litre,5 %,2 Molar,0.5 moles,D
"Given that the healthy range of sodium ion concentration in the blood is 137– 145 mmol/L, if the measured concentration of a blood sample was 130 mmol/L, what would the condition be called?",hyperkalemia,hypokalemia,hypernatremia,hyponatremia,D
What can be said about a solution that conducts electricity?,the solute is a polar molecule,the solvent is a non-polar liquid,the solution contains dissolved ions,the solution contains dissolved molecules,C
A one litre IV bag contains 0.18 % sodium chloride and 4 % glucose. What mass of solutes would be dissolved in 100 ml of the solution?,0.18 g of sodium chloride and 4 g of glucose,1.8 g of sodium chloride and 4 g of glucose,1.8 g of sodium chloride and 40 g of glucose,18 g of sodium chloride and 40 g of glucose,A
"If a solution is shown to be able to conduct electricity, then what is true?",A: the solution is free of impurities,B: the solution contains a dissolved electrolyte,C: the solution contains dissolved molecules,D: the solution is an aqueous solution,B
How many grams of sodium chloride are there in a one litre bag of 4 % glucose and 0.18 % sodium chloride solution?,0.18,1.8,18,41.8,B
"In the vascular compartment of the body, what is the solvent?",blood,plasma,serum,water,D
"A solution of 5 % glucose is infused over a period of three hours. If 250 ml of solution was used, how many grams of glucose was infused?",5 g,12.5 g,15.0 g,50 g,B
A solution is prepared by dissolving 10 g of glucose in 250 ml of water. What will be the concentration of this solution expressed as a percentage?,4,6,25,40,A
Blood has a slightly higher osmotic pressure than the interstitial fluid that sur - rounds capillaries. What is the effect of this?,Water will tend to move from the interstitial fluid into the capillaries.,The solution concentration of blood is less than the solution concentration of interstitial fluid.,Water will tend to move from the capillaries into the interstitial fluid.,Capillaries will expand in diameter.,A
Osmosis involves movement of water from where the:,water concentration is lower to where it is higher,solute concentration is higher to where it is lower4.3 Diffusion and Osmosis 68,solution is more concentrated to where it is less concentrated,water concentration is higher to where it is lower,D
What information does the molarity of a solution provide?,the density of a solution,the number of dissolved particles per litre of solution,the mass of a mole of the substance,the tonicity of the solution,B
What term is applied to an intravenous solution that would cause a net move- ment of water out of red blood cells?,hypertonic,supertonic,epitonic,hypotonic,A
What is a definition of an osmole? The amount of substance that:,must be dissolved to produce 6 × 10 23 solute particles.,must be dissolved to produce an osmotic pressure of 1.0 mmHg.,must be dissolved to produce an isotonic solution.,contains 6 × 1023 particles.,A
Choose the solution below that has the lowest concentration of dissolved particles.,0.9 % NaCl,isotonic powerade,5 % glucose,hypotonic saline,D
What can be correctly said of an isotonic intravenous solution? An isotonic solution:,causes water to move out of red blood cells.,causes no net movement of water into or out of red blood cells.,has the same solutes in the same solution concentration as blood plasma 4 Chemistry for Physiology 71,causes water to move into red blood cells.,B
What would be the concentration of a solution that causes red blood cells placed in it to swell?,hypotonic,isotonic,hypertonic,iso-osmotic,A
An isotonic solution is one which,has an osmotic pressure that is different to red blood cells,has an osmolarity less than that of red blood cells,causes no net movement of water between the solution and red blood cells,has an osmolarity greater than that of red blood cells,C
A hypotonic solution may be characterised by which of the following?,a solution whose osmolarity is greater than that of blood.,one that causes red blood cells to crenate.,a solution within the range 280–300 mosmol/L,one that causes a net water movement into red blood cells.,D
Which of the following statements could be applied to a hypertonic solution?,it causes red blood cells to shrink and crenate.,it causes red blood cells to swell and perhaps lyse.,it is a solution with an osmolarity less than that of blood.,it causes movement of water into red blood cells.,A
To what does the term “mole” refer?,the smallest particle of a molecular compound.,the amount of solute that must be dissolved in water to make an isotonic solution.,an amount of substance that contains 6.02 × 10 23 particles.,a group of 2 or more atoms bonded together.,C
What may be said of isotonic solutions? They have:,had added the same number of moles of solid substance per volume of solution.,the same number of grams of solute per volume of solution.,the same percent concentration.,the same number of dissolved particles per volume of solution.,D
"Fructose is a sugar with a molecular formula C 6H12O6. Given that the atomic weights are: C = 12, H = 1 and O = 16, how many moles of fructose are there in 36 grams?",0.01 moles,"0.10 moles4.4 Tonicity, Moles and Osmoles 74",0.20 moles,0.50 moles,C
"Ribose is a sugar with molecular formula C 5H10O5. Given that the atomic weights are: C = 12, H = 1 and O = 16, how many moles of ribose are there in 3 grams?",0.01 moles,0.02 moles,0.05 moles,0.10 moles,B
"A solution is prepared containing 2 % sodium chloride (Na+Cl−). Which of the following best describes the osmolarity of this solution? (Note : Na = 23, Cl = 35.5)",340 mosmol/L,680 mosmol/L,340 osmol/L,680 osmol/L,B
"Given that one mole of glucose has a mass of 180 g, how many millimole of glucose does 40 g of glucose contain?",0.222,180,222,278,C
Which of the following statements about an “osmole” is correct? An osmole is the:,same as a mole for ionic substances.,formula weight of a substance expressed in grams.,number of moles multiplied by the number of molecules in the chemical formula.,amount of substance that must be dissolved in order to produce 1.6 × 1023 dissolved particles.,D
"Glucose is a sugar with a molecular formula C 6H12O6. Given that the atomic weights are: C = 12, H = 1 and O = 16, what is the mass of 1 mole of glucose?",1.8 g,18 g,180 g,1800 g,C
"Lactose is a sugar with a molecular formula C 12H22O11. Given that the atomic weights are: C = 12, H = 1 and O = 16, what is the weight of 1 mole of lactose?",3.42 g,34.2 g,342 g,3420 g,C
Red blood cells are added to a hypotonic solution of glucose. Which of the fol-lowing best describes what you would observe?,The cells would most likely sink to the bottom unaffected,"The cells would shrink due to water loss.4.4 Tonicity, Moles and Osmoles 76",The cells would coagulate.,The cells would swell and burst due to intake of water,D
A solution that is said to be isotonic to blood has the same:,percent concentration as blood.,number of moles of dissolved particles as blood.,number of osmoles per litre of dissolved particles as blood.,number of dissolved particles as blood.,C
"If the following amounts of the given substances were dissolved in water, which would result in four osmoles of dissolved particles?",2 moles of C 6H12O6,2 moles of Na+Cl−,2 moles of C 12H22O11,2 moles of (Na+)2SO 42−,B
What is the difference between “molarity” and “osmolarity”?,molarity applies only to covalent compounds while osmolarity applies only to ionic compounds.,osmolarity is molarity multiplied by two.,"the molarity and osmolarity of a solution is the same for dissolved ionic compounds, but are different for dissolved covalent compounds.",osmolarity refers to the concentration of dissolved particles in a solution which may not be the same as the number of moles of substance that was dissolved per litre of solution.,D
Human blood has an osmolarity that lies within the range 280–300 mosmol/L. Which of the following statements is correct?,an isotonic solution has osmolarity that is either less than 280 or greater than 300 mosmol/L,a hypotonic solution has osmolarity between 280 and 300 mosmol/L 4 Chemistry for Physiology 77,a hypertonic solution has osmolarity between 280 and 300 mosmol/L,an isotonic solution has osmolarity between 280 and 300 mosmol/L,D
What distinguishes an osmole from a mole?,"In a sample of substance, the number of osmoles is twice the number of moles","Both mole and osmole may be used in reference to ionic compounds, while covalent compounds are described by mole alone.",the mass of a mole is the sum of the relative atomic masses (RAM) of the atoms in the formula stated as grams. An osmole is half of this mass.,"an osmole applies only to covalent molecular substances, whereas a mole is validly applied to both covalent and ionic substances.",B
"Given that a mole is 6 × 10 23 particles, what is a millimole?",6 × 1020 particles,one thousand moles,6 × 1026 particles,0.0001 moles,A
A solution that is isotonic to blood plasma is one which,contains 0.5 % glucose,must contain the same solutes as blood and in the same concentration as in blood,has an osmolarity between 280 and 300 mosmol/L,causes no net movement of water into or out of cells,D
"Which of the following quantities of substance would, when dissolved in one litre of water, produce a solution with the highest osmolarity?",1 mole of glucose molecules (C 6H12O6),1 mole of Na+Cl− (sodium chloride),1 mole of haemoglobin molecules,1 osmole of K+ (potassium ions),B
Which of the following statements is CORRECT?,An acid is an electron donor and a base is an electron acceptor.,An acidic solution has a pH less than 7 and a basic solution has a pH greater than 7.,Neutralization of a strong acid by a strong base gives only water.,The pH of saliva is normally in the range of 8.5–9.5,B
"Which statement about buffers below is most correct?4.5 Acids, Bases and Buffers 80",A buffer is any acid and base which together control the concentration of pH in the blood.,A buffer is the solution which allows CO 2 to be lost from the lungs in order to control the pH of the lungs.,A buffer is a weak base and its acid salt or a weak acid and its basic salt. The ratio of the two components helps maintain blood pH levels.,A buffer is a mixture of two acids which together help to maintain blood pH,C
Which of the following statements is FALSE?,An acid is a proton donor and a base is a proton acceptor.,An acidic solution has a pH greater than 7 and a basic solution has a pH less than 7.,Neutralization of an acid by a base gives a solution of salt in water.,The pH of the stomach is normally in the range of 1.6–1.8,B
Neutralization of an acid by a base can be represented by the following equation: HO OH HO32 2+−+→ This means that the pH of the solution after the neutralization is approximately:,6,7,8,9,B
A buffer solution consisting of citric acid and citrate in a ratio of 5:1 maintains the pH at 7.4. What would be the ratio of the two components if the pH were to become 6.4,6:1,10:1,50:1,1:10,C
Which of the following statements is closest to a correct definition of an acid?,a substance that ionises in a solution to produce hydronium and hydroxide ions.,a substance that reacts with water to produce hydroxide ions.,a substance that dissociates in water to produce a solution with pH greater than 7.0.,a substance that reacts partly with water to produce a low concentration of hydronium ions.,D
The pH of a buffered solution depends on:,the ratio of the components of the buffer solution.,the amount of acid added to the buffer solution.,the amount of base added to the buffer solution.,the amount of acid and of base added to the solution.,A
The long term acid-base balance in the body is controlled by,the phosphate and carbonic acid/bicarbonate buffers in the blood,the kidneys and the lungs,"the phosphate, carbonic acid/bicarbonate, and protein buffers in the blood and cells.",the kidneys,B
You have a bottle of a strong acid and you add 100 ml of this to one litre of water. What would the pH of this final solution most likely be?,pH = 1,pH = 5,pH = 7,pH = 11,A
A buffer solution consisting of acetic acid and acetate ions (base) in a ratio of acid to base of 1:20 maintains the pH at 7.4. What is the ratio of the two com-ponents if the pH were to become 8.4 after addition of more of the basic component.,1:200,1:21,1:30,1:40,A
"Acidity is stated as a pH value. If the pH of urine sample “A” is 6 and the pH of urine sample “B” is 7, then which of the following is true?",the most acidic sample is sample,B. sample A has 10 times the hydroxide ion concentration of sample B.,the B sample has 10 times the hydrogen ion concentration of sample A.,sample A has 10 times the hydrogen ion concentration of sample B.,D
"One form of acid base imbalance in the body is called acidosis. In this situation, which of the following is true?",the blood is less alkaline than it should be.,the blood’s pH is less than 7.0,the blood is less acidic than it should be.,the concentration of hydrogen ions in the blood is less than it should be.,A
One of the buffer systems in the blood is the carbonic acid/bicarbonate buffer. It helps to maintain the body’s acid-base balance by destroying any excess:,hydrogen ions in the blood.,acid or base in the blood.,hydroxide ions formed in the blood.,bicarbonate ions formed in the blood.,B
The major buffer system in the extracellular compartment is the:,the protein buffer,carbonic acid/bicarbonate buffer,ammonia buffer,phosphate buffer,B
What happens when an acid is added to a buffered solution?,the solution becomes acidic,the pH of the solution decreases significantly,the pH of the solution decreases very slightly,the pH of the solution increases slightly,C
Which of the statements below is correct?,"The dihydrogen phosphate component of the phosphate buffer releases hydrogen ions into the lungs for excretion, and in the process, reverts to monohydrogen phosphate.","Haemoglobin as it passes through the lungs, releases hydronium ions, which are breathed out.",Carbon dioxide that is dissolved in blood diffuses into the alveoli and is breathed out.,Hydronium ions react with bicarbonate ions to form carbonic acid which moves into the lungs for exhalation.,C
"When aspirin (an acid) is in the stomach (an acidic environment), what may be said of the aspirin molecules?",Most molecules will be un-ionised and therefore able to be pass through the stomach mucosa.,Most molecules will be ionised and therefore able to be pass through the stomach mucosa.,Most molecules will be un-ionised and therefore NOT able to be pass through the stomach mucosa.,Aspirin will be in the form of its salt and therefore able to be pass through the stomach mucosa.,A
Which statement below best describes an acid solution? The pH is less than:,5,6,7,8,C
"If a patient has blood pH that is 7.3 (which is below the healthy range of blood pH values), which of the following is a correct statement?",the patient has alkalosis,the patient has excessive alkali,the patient has acidosis,the patient has insufficient acid,C
Which of the following mechanisms results in acid being excreted from the body?,breathing out H 2PO 4- (dihydrogen-phosphate) from the lungs,excreting HCO 3- in the urine,excreting NH 3 (ammonia) in the urine,breathing out CO 2 from the lungs,D
